{
  "roster": 1,
  "about": "Great Outdoors drivers as data (crates/red_core/src/sim/kart.rs, Driver): the order is the wire order, so it never changes; `base` is the kart every driver starts from and `spec` lists only what a driver changes. Speeds m/s, accelerations m/s^2, steer_rate degrees per second, multipliers of top speed.",
  "base": {"top_speed": 24.0, "accel": 12.0, "brake": 26.0, "reverse_speed": 6.0, "steer_rate": 90.0, "grip": 0.8, "mass": 1.0, "dirt": 0.85, "mud": 0.6, "water": 0.55, "boost_mult": 1.3, "drift_rate": 1.0, "hop_speed": 4.0},
  "drivers": [
    {"name": "Duck", "ability": "float", "spec": {"water": 1.0}},
    {"name": "Bunny", "ability": "hop", "spec": {"top_speed": 22.0, "accel": 16.0, "steer_rate": 110.0, "grip": 0.75, "mass": 0.8, "drift_rate": 1.2, "hop_speed": 5.5}},
    {"name": "Deer", "ability": "drift_boost", "spec": {"top_speed": 27.0, "accel": 10.0, "steer_rate": 85.0, "mass": 0.9, "drift_rate": 1.3}},
    {"name": "Coyote", "ability": "dirt", "spec": {"top_speed": 25.0, "steer_rate": 90.0, "grip": 0.7, "mass": 0.9, "dirt": 1.0}},
    {"name": "Hawk", "ability": "glide", "spec": {"top_speed": 25.0, "accel": 11.0, "mass": 0.7}},
    {"name": "Bear", "ability": "bulldoze", "spec": {"top_speed": 22.0, "accel": 9.0, "steer_rate": 70.0, "grip": 0.85, "mass": 1.6, "drift_rate": 0.8, "hop_speed": 3.0}},
    {"name": "Wolf", "ability": "slipstream", "spec": {"top_speed": 25.0, "steer_rate": 92.0, "grip": 0.78}},
    {"name": "Beaver", "ability": "build", "spec": {"top_speed": 21.0, "accel": 9.0, "steer_rate": 78.0, "grip": 0.85, "mass": 1.3, "dirt": 1.0, "mud": 1.0, "water": 1.0, "drift_rate": 0.9}}
  ]
}
